id,category,query,answer,expected_answer,faithfulness,faithfulness_notes,relevance,relevance_notes,context_recall,context_recall_notes,completeness,completeness_notes,config_label
q19,IT Helpdesk,"Công ty dùng VPN nào, mỗi tài khoản được kết nối tối đa bao nhiêu thiết bị, và nếu VPN lỗi liên tục thì làm gì?","Công ty sử dụng VPN Cisco AnyConnect. Mỗi tài khoản được kết nối tối đa 2 thiết bị cùng lúc. Nếu VPN lỗi liên tục, cần kiểm tra kết nối Internet trước, nếu vẫn lỗi thì tạo ticket P3 với log file VPN đính kèm [1].",Công ty dùng Cisco AnyConnect. Mỗi tài khoản được kết nối tối đa 2 thiết bị cùng lúc. Nếu VPN vẫn lỗi sau khi kiểm tra Internet thì tạo ticket P3 kèm log file VPN.,5,"The answer accurately reflects the information provided in the retrieved chunks regarding the use of Cisco AnyConnect VPN, the limit on the number of devices, and the troubleshooting steps for VPN connection issues.",5,"Answers the question directly and fully, providing details about the VPN used, the number of devices allowed, and the troubleshooting steps if the VPN fails.",5,Retrieved: 1/1 expected sources,5,Covers all key points.,baseline_dense
q20,Insufficient Context,ERR-403-AUTH là lỗi gì và cách xử lý thế nào?,Tôi không biết.,Không tìm thấy thông tin về ERR-403-AUTH trong các tài liệu hiện có.,1,"The answer 'Tôi không biết' does not relate to any of the provided context or questions, indicating a complete lack of grounding in the information given.",1,Does not answer the question or completely off-topic.,,No expected sources,1,"Model answer does not provide any relevant information about ERR-403-AUTH, missing all key points.",baseline_dense
q01,SLA,SLA xử lý ticket P1 là bao lâu?,SLA xử lý ticket P1 là 4 giờ [2].,Ticket P1 có SLA phản hồi ban đầu 15 phút và thời gian xử lý (resolution) là 4 giờ.,5,"The statement accurately reflects the provided context regarding the SLA for ticket P1, which is confirmed to be 4 hours.",5,Answers the question directly and fully.,5,Retrieved: 1/1 expected sources,3,"The model answer provides the resolution time of 4 hours but omits the initial response time of 15 minutes, which is an important detail.",variant_hybrid_rerank
q02,Refund,Khách hàng có thể yêu cầu hoàn tiền trong bao nhiêu ngày?,Khách hàng có thể yêu cầu hoàn tiền trong vòng 7 ngày làm việc kể từ thời điểm xác nhận đơn hàng [2].,Khách hàng có thể yêu cầu hoàn tiền trong vòng 7 ngày làm việc kể từ thời điểm xác nhận đơn hàng.,5,The answer accurately reflects the information provided in the context about the timeframe for requesting a refund.,5,Answers the question directly and fully.,5,Retrieved: 1/1 expected sources,5,Covers all key points.,variant_hybrid_rerank
q03,Access Control,Ai phải phê duyệt để cấp quyền Level 3?,"Để cấp quyền Level 3, cần có sự phê duyệt của Line Manager, IT Admin và IT Security [3].","Level 3 (Elevated Access) cần phê duyệt từ Line Manager, IT Admin, và IT Security.",5,"The answer accurately reflects the requirement for Level 3 access approval, which includes Line Manager, IT Admin, and IT Security, as stated in the provided context.",5,Answers the question directly and fully.,5,Retrieved: 1/1 expected sources,5,Covers all key points.,variant_hybrid_rerank
q04,Refund,Sản phẩm kỹ thuật số có được hoàn tiền không?,"Sản phẩm kỹ thuật số không được hoàn tiền, trừ khi có lỗi do nhà sản xuất và đáp ứng các điều kiện khác [1].","Không. Theo chính sách hoàn tiền, sản phẩm thuộc danh mục hàng kỹ thuật số (license key, subscription) là ngoại lệ không được hoàn tiền.",4,"The answer correctly states that digital products are not refundable unless there is a manufacturer defect and other conditions are met, but it does not mention the specific time frame for requesting a refund.",4,Answers correctly but misses minor details about specific conditions for refunds.,5,Retrieved: 1/1 expected sources,4,"The model answer correctly states that digital products are generally non-refundable and mentions exceptions for manufacturer errors, but it lacks the specific mention of the types of digital products (license key, subscription) that are explicitly stated in the expected answer.",variant_hybrid_rerank
q05,IT Helpdesk,Tài khoản bị khóa sau bao nhiêu lần đăng nhập sai?,"Tài khoản bị khóa sau 5 lần đăng nhập sai liên tiếp. Để mở khóa, liên hệ IT Helpdesk hoặc tự reset qua portal SSO [1].",Tài khoản bị khóa sau 5 lần đăng nhập sai liên tiếp.,5,The answer accurately reflects the information provided in the context regarding account lockout after 5 failed login attempts and the methods to unlock it.,5,Answers the question directly and fully.,5,Retrieved: 1/1 expected sources,4,"The model answer includes additional information about unlocking the account, which is a minor detail, but the core answer about the number of failed login attempts is complete.",variant_hybrid_rerank
q06,SLA,Escalation trong sự cố P1 diễn ra như thế nào?,"Escalation trong sự cố P1 diễn ra như sau: On-call IT Admin có thể cấp quyền tạm thời (tối đa 24 giờ) sau khi được Tech Lead phê duyệt bằng lời. Sau 24 giờ, phải có ticket chính thức hoặc quyền sẽ bị thu hồi tự động. Tất cả quyền tạm thời phải được ghi log vào hệ thống Security Audit [3].",Ticket P1 tự động escalate lên Senior Engineer nếu không có phản hồi trong 10 phút sau khi tạo ticket.,5,"The answer accurately reflects the escalation process for P1 incidents as described in the provided context, including the approval process, time limits, and logging requirements.",5,"Answers the question directly and fully, providing a clear explanation of the escalation process for P1 incidents.",5,Retrieved: 1/1 expected sources,2,"The model answer focuses on the temporary granting of permissions by the on-call IT Admin and the logging of these actions, but it does not mention the automatic escalation of the P1 ticket to a Senior Engineer if there is no response within 10 minutes, which is a critical point in the expected answer.",variant_hybrid_rerank
q07,Access Control,Approval Matrix để cấp quyền hệ thống là tài liệu nào?,Approval Matrix để cấp quyền hệ thống không được đề cập trong các tài liệu đã cung cấp. Tôi không biết.,Tài liệu 'Approval Matrix for System Access' hiện tại có tên mới là 'Access Control SOP' (access-control-sop.md).,2,"The response mentions an 'Approval Matrix' for granting system access, which is not mentioned in the provided context, indicating a significant deviation from the information given.",2,The answer does not provide relevant information about what an Approval Matrix is or its purpose in granting system permissions.,5,Retrieved: 1/1 expected sources,1,"The model answer does not provide any relevant information about the Approval Matrix and fails to mention its current name, missing the core content of the expected answer.",variant_hybrid_rerank
q08,HR Policy,Nhân viên được làm remote tối đa mấy ngày mỗi tuần?,Tôi không biết.,"Nhân viên sau probation period có thể làm remote tối đa 2 ngày/tuần, với điều kiện được Team Lead phê duyệt.",1,"The response 'Tôi không biết' does not relate to or provide any information based on the provided context about employee rights, leave requests, or overtime conditions.",1,Does not answer the question or completely off-topic.,5,Retrieved: 1/1 expected sources,1,"The model answer does not provide any relevant information regarding the remote work policy, missing all key points from the expected answer.",variant_hybrid_rerank
q09,Insufficient Context,ERR-403-AUTH là lỗi gì và cách xử lý?,Tôi không biết.,"Không tìm thấy thông tin về ERR-403-AUTH trong tài liệu hiện có. Đây có thể là lỗi liên quan đến xác thực (authentication), hãy liên hệ IT Helpdesk.",1,"The answer 'Tôi không biết' does not relate to any of the provided context or questions, indicating a complete lack of grounding in the information given.",1,Does not answer the question or completely off-topic.,,No expected sources,1,"Model answer does not provide any information about ERR-403-AUTH or how to handle it, missing all key points.",variant_hybrid_rerank
q10,Refund,"Nếu cần hoàn tiền khẩn cấp cho khách hàng VIP, quy trình có khác không?",Tôi không biết.,"Tài liệu chính sách hoàn tiền không đề cập đến quy trình đặc biệt cho khách hàng VIP. Theo chính sách hiện hành, tất cả yêu cầu hoàn tiền đều theo cùng quy trình tiêu chuẩn trong 3-5 ngày làm việc.",1,"The answer 'Tôi không biết' does not relate to or provide any information based on the provided context, which discusses refund methods and an internal access permission process.",1,Does not answer the question or completely off-topic.,5,Retrieved: 1/1 expected sources,1,"Model answer does not provide any information regarding the refund process for VIP customers, missing all key points from the expected answer.",variant_hybrid_rerank
q01,SLA,SLA xử lý ticket P1 là bao lâu?,SLA xử lý ticket P1 là 4 giờ [2].,Ticket P1 có SLA phản hồi ban đầu 15 phút và thời gian xử lý (resolution) là 4 giờ.,5,"The statement accurately reflects the provided context regarding the SLA for ticket P1, which is confirmed to be 4 hours.",5,Answers the question directly and fully.,5,Retrieved: 1/1 expected sources,3,"The model answer provides the resolution time of 4 hours but omits the initial response time of 15 minutes, which is an important detail.",variant_hybrid_rerank
q02,SLA,Nếu ticket P1 không có phản hồi trong 10 phút thì hệ thống xử lý thế nào?,"Nếu ticket P1 không có phản hồi trong 10 phút, hệ thống sẽ tự động escalate lên Senior Engineer [1].",Ticket P1 sẽ tự động escalate lên Senior Engineer nếu không có phản hồi trong 10 phút.,5,The statement accurately reflects the escalation process for ticket P1 as described in the provided context.,5,Answers the question directly and fully.,5,Retrieved: 1/1 expected sources,5,Covers all key points.,variant_hybrid_rerank
q03,SLA,"Sau khi xử lý xong sự cố P1, phải viết incident report trong bao lâu?","Sau khi khắc phục sự cố P1, phải viết incident report trong vòng 24 giờ [1].","Sau khi khắc phục xong, phải viết incident report trong vòng 24 giờ.",5,"The statement accurately reflects the requirement to write an incident report within 24 hours after resolving a P1 incident, as stated in the provided context.",5,Answers the question directly and fully.,5,Retrieved: 1/1 expected sources,5,Covers all key points.,variant_hybrid_rerank
q04,Refund,Khách hàng có thể yêu cầu hoàn tiền trong bao nhiêu ngày làm việc kể từ lúc xác nhận đơn hàng?,Khách hàng có thể yêu cầu hoàn tiền trong vòng 7 ngày làm việc kể từ thời điểm xác nhận đơn hàng [1].,Khách hàng có thể yêu cầu hoàn tiền trong vòng 7 ngày làm việc kể từ thời điểm xác nhận đơn hàng.,5,The answer accurately reflects the information provided in the context regarding the timeframe for requesting a refund.,5,Answers the question directly and fully.,5,Retrieved: 1/1 expected sources,5,Covers all key points.,variant_hybrid_rerank
q05,Refund,Sản phẩm license key hoặc subscription có được hoàn tiền không?,"Sản phẩm license key hoặc subscription không được hoàn tiền theo chính sách, vì thuộc danh mục hàng kỹ thuật số [1].",Không. Sản phẩm thuộc danh mục hàng kỹ thuật số như license key và subscription là ngoại lệ không được hoàn tiền.,5,The answer accurately reflects the information provided in the retrieved chunks regarding the non-refundable status of license keys and subscriptions as digital goods.,5,Answers the question directly and fully.,5,Retrieved: 1/1 expected sources,5,Covers all key points.,variant_hybrid_rerank
q06,Refund,Đơn hàng đã áp dụng Flash Sale có được hoàn tiền không?,Đơn hàng đã áp dụng mã giảm giá đặc biệt theo chương trình khuyến mãi Flash Sale sẽ không được hoàn tiền [2].,Không. Đơn hàng đã áp dụng mã giảm giá đặc biệt theo chương trình khuyến mãi Flash Sale là ngoại lệ không được hoàn tiền.,5,The statement accurately reflects the information provided in the retrieved chunks regarding the refund policy for orders that have applied special discount codes during Flash Sale promotions.,5,"The answer directly addresses the question about whether orders with Flash Sale discounts can be refunded, stating that they cannot be refunded.",5,Retrieved: 1/1 expected sources,4,"The model answer conveys the main point that orders with Flash Sale discounts are not eligible for refunds, but it lacks the explicit 'No' at the beginning and does not emphasize that this is an exception.",variant_hybrid_rerank
q07,Refund,Đơn hàng đặt trước ngày 01/02/2026 sẽ theo chính sách nào?,Đơn hàng đặt trước ngày 01/02/2026 sẽ áp dụng theo chính sách hoàn tiền phiên bản 3 [1].,Đơn hàng đặt trước ngày có hiệu lực sẽ áp dụng theo chính sách hoàn tiền phiên bản 3.,5,The answer accurately reflects the information provided in the context regarding the application of the refund policy for orders placed before 01/02/2026.,5,Answers the question directly and fully.,5,Retrieved: 1/1 expected sources,4,"The model answer correctly identifies the policy that applies to orders placed before the specified date, but it does not explicitly mention that the date is the effective date, which is a minor detail in the expected answer.",variant_hybrid_rerank
q08,Access Control,Approval Matrix for System Access là tài liệu nào hiện nay?,"Approval Matrix for System Access là tài liệu quy định quy trình cấp phép truy cập vào các hệ thống nội bộ của công ty, áp dụng cho tất cả nhân viên, contractor, và third-party vendor [2].","Tài liệu này hiện có tên mới là Access Control SOP, với source là it/access-control-sop.md.",5,"The answer accurately reflects the content of the retrieved chunks, specifically stating that the document regulates the access approval process for internal systems and applies to all employees, contractors, and third-party vendors.",5,"The answer directly and fully explains what the Approval Matrix for System Access is, including its purpose and who it applies to.",5,Retrieved: 1/1 expected sources,2,"The model answer does not mention the new name 'Access Control SOP' or the specific source 'it/access-control-sop.md', which are key points in the expected answer.",variant_hybrid_rerank
q09,Access Control,Nhân viên phải tạo access request ticket ở đâu và bước nào có IT Security review?,"Nhân viên phải tạo Access Request ticket trên Jira (project IT-ACCESS). Bước có IT Security review là Bước 4, khi IT Security thực hiện review với Level 3 và Level 4 [1].",Nhân viên tạo Access Request ticket trên Jira project IT-ACCESS. IT Security review ở bước 4 đối với Level 3 và Level 4.,5,"The answer accurately reflects the steps outlined in the provided context regarding the Access Request process, specifically mentioning the creation of the ticket and the IT Security review.",5,The answer directly addresses the question by specifying where to create the access request ticket and clearly identifies the step involving IT Security review.,5,Retrieved: 1/1 expected sources,5,Covers all key points.,variant_hybrid_rerank
q10,Access Control,Level 1 đến Level 4 cần ai phê duyệt và mất bao lâu?,"Level 1 cần phê duyệt từ Line Manager và mất 1 ngày làm việc. Level 2 cần phê duyệt từ Line Manager và IT Admin, mất 2 ngày làm việc. Level 3 cần phê duyệt từ Line Manager, IT Admin và IT Security, mất 3 ngày làm việc. Level 4 cần phê duyệt từ IT Manager và CISO, mất 5 ngày làm việc [1].","Level 1 cần Line Manager và mất 1 ngày làm việc. Level 2 cần Line Manager + IT Admin và mất 2 ngày làm việc. Level 3 cần Line Manager + IT Admin + IT Security và mất 3 ngày làm việc. Level 4 cần IT Manager + CISO và mất 5 ngày làm việc, kèm training bắt buộc về security policy.",5,The answer accurately reflects the approval requirements and processing times for each access level as provided in the context.,5,The answer directly and fully addresses the question by providing the required approvals and the time needed for each level.,5,Retrieved: 1/1 expected sources,4,"The model answer covers all the key points regarding the approval levels and timeframes, but it misses the detail about the mandatory training on security policy for Level 4.",variant_hybrid_rerank
q11,Access Control,"Khi có sự cố P1, quyền tạm thời tối đa được cấp bao lâu, cần ai phê duyệt, và có phải log không?","Khi có sự cố P1, quyền tạm thời tối đa được cấp là 24 giờ, cần có sự phê duyệt bằng lời của Tech Lead, và mọi quyền tạm thời phải được ghi log vào hệ thống Security Audit [1].","On-call IT Admin có thể cấp quyền tạm thời tối đa 24 giờ sau khi được Tech Lead phê duyệt bằng lời, và mọi quyền tạm thời phải được ghi log vào hệ thống Security Audit.",5,"The answer accurately reflects the information provided in the context regarding the escalation process for granting temporary permissions during a P1 incident, including the maximum duration, requirement for Tech Lead approval, and the logging of permissions.",5,"Answers the question directly and fully, providing details on the duration, approval needed, and logging requirements.",5,Retrieved: 1/1 expected sources,5,Covers all key points.,variant_hybrid_rerank
q12,Access Control,"Quyền truy cập bị thu hồi trong các trường hợp nghỉ việc, hết hạn contract, và chuyển bộ phận như thế nào?","Quyền truy cập bị thu hồi trong các trường hợp như sau:
- Nhân viên nghỉ việc: Thu hồi ngay trong ngày cuối.
- Hết hạn contract: Thu hồi đúng ngày hết hạn.
- Chuyển bộ phận: Điều chỉnh trong 3 ngày làm việc [1].",Nghỉ việc: thu hồi ngay trong ngày cuối. Hết hạn contract: thu hồi đúng ngày hết hạn. Chuyển bộ phận: điều chỉnh trong 3 ngày làm việc.,5,The answer accurately reflects the conditions under which access rights are revoked as stated in the provided context.,5,Answers the question directly and fully.,5,Retrieved: 1/1 expected sources,5,Covers all key points.,variant_hybrid_rerank
q13,Access Control,IT Security review access mỗi bao lâu một lần và bất thường phải báo trong bao lâu?,IT Security thực hiện access review mỗi 6 tháng. Mọi bất thường phải được báo cáo lên CISO trong vòng 24 giờ [1].,"IT Security thực hiện access review mỗi 6 tháng, và mọi bất thường phải được báo cáo lên CISO trong vòng 24 giờ.",5,The answer accurately reflects the information provided in the retrieved chunks regarding IT Security's access review process and the requirement to report abnormalities to the CISO within 24 hours.,5,Answers the question directly and fully.,5,Retrieved: 1/1 expected sources,5,Covers all key points.,variant_hybrid_rerank
q14,HR Policy,Nhân viên có 4 năm kinh nghiệm được bao nhiêu ngày annual leave và được carry over tối đa bao nhiêu ngày?,Nhân viên có 4 năm kinh nghiệm được 15 ngày annual leave và có thể carry over tối đa 5 ngày sang năm tiếp theo [1].,"Nhân viên từ 3-5 năm kinh nghiệm được 15 ngày annual leave mỗi năm, và có thể chuyển tối đa 5 ngày phép chưa dùng sang năm tiếp theo.",5,"The answer accurately reflects the information provided in the context regarding annual leave for an employee with 4 years of experience, stating they are entitled to 15 days and can carry over a maximum of 5 days to the next year.",5,Answers the question directly and fully.,5,Retrieved: 1/1 expected sources,4,"The model answer covers the main points about the annual leave and carry over days, but it lacks the clarification that the 15 days of annual leave applies specifically to employees with 3-5 years of experience.",variant_hybrid_rerank
q15,HR Policy,"Nghỉ ốm được trả lương bao nhiêu ngày, phải báo trước lúc nào, và nếu nghỉ trên 3 ngày liên tiếp thì cần gì?","Nghỉ ốm được trả lương 10 ngày/năm. Cần thông báo cho Line Manager trước 9:00 sáng ngày nghỉ. Nếu nghỉ trên 3 ngày liên tiếp, cần có giấy tờ y tế từ bệnh viện [3].",Nghỉ ốm được trả lương 10 ngày/năm. Phải báo cho Line Manager trước 9:00 sáng ngày nghỉ. Nếu nghỉ trên 3 ngày liên tiếp thì cần giấy tờ y tế từ bệnh viện.,5,"The answer accurately reflects the information provided in the retrieved chunks regarding sick leave, including the number of paid days, the requirement to notify the Line Manager, and the need for medical documentation if absent for more than three consecutive days.",5,"Answers the question directly and fully, providing details on the number of paid sick leave days, notification requirements, and the need for medical documentation for absences over three days.",5,Retrieved: 1/1 expected sources,5,Covers all key points.,variant_hybrid_rerank
q16,HR Policy,"Nhân viên sau probation có thể làm remote tối đa bao nhiêu ngày/tuần, onsite bắt buộc ngày nào, và có yêu cầu gì khi remote?",Nhân viên sau probation có thể làm remote tối đa 2 ngày/tuần. Ngày onsite bắt buộc là Thứ 3 và Thứ 5. Yêu cầu khi remote bao gồm kết nối VPN và bật camera trong các cuộc họp team [1].,Nhân viên sau probation có thể làm remote tối đa 2 ngày mỗi tuần. Ngày onsite bắt buộc là Thứ 3 và Thứ 5. Khi remote phải bật VPN và bật camera trong các cuộc họp team.,5,"The answer accurately reflects the conditions for remote work, including the maximum number of remote days, mandatory onsite days, and technical requirements for remote work as stated in the provided context.",5,Answers the question directly and fully.,5,Retrieved: 1/1 expected sources,5,Covers all key points.,variant_hybrid_rerank
q17,HR Policy,"Làm thêm giờ phải được phê duyệt như thế nào và hệ số lương ngày thường, cuối tuần, ngày lễ là bao nhiêu?","Làm thêm giờ phải được Line Manager phê duyệt trước bằng văn bản. Hệ số lương cho làm thêm giờ là: 150% lương giờ tiêu chuẩn vào ngày thường, 200% vào ngày cuối tuần, và 300% vào ngày lễ [1].","Làm thêm giờ phải được Line Manager phê duyệt trước bằng văn bản. Hệ số lương là 150% vào ngày thường, 200% vào ngày cuối tuần, và 300% vào ngày lễ.",5,The answer accurately reflects the information provided in the retrieved chunks regarding the requirement for Line Manager approval for overtime and the corresponding overtime pay rates.,5,"Answers the question directly and fully, providing details on approval process and pay rates for overtime.",5,Retrieved: 1/1 expected sources,5,Covers all key points.,variant_hybrid_rerank
q18,IT Helpdesk,"Quên mật khẩu thì làm gì, và tài khoản bị khóa sau bao nhiêu lần đăng nhập sai liên tiếp?","Nếu quên mật khẩu, bạn cần truy cập https://sso.company.internal/reset hoặc liên hệ Helpdesk qua ext. 9000 để nhận mật khẩu mới qua email công ty trong vòng 5 phút. Tài khoản sẽ bị khóa sau 5 lần đăng nhập sai liên tiếp, và để mở khóa, bạn có thể liên hệ IT Helpdesk hoặc tự reset qua portal SSO [1].",Có thể truy cập trang reset SSO hoặc liên hệ Helpdesk qua ext. 9000. Tài khoản bị khóa sau 5 lần đăng nhập sai liên tiếp.,5,The answer accurately reflects the information provided in the retrieved chunks regarding password reset procedures and account lockout policies.,5,"Answers the question directly and fully, providing clear instructions for both resetting the password and information about account lockout.",5,Retrieved: 1/1 expected sources,5,Covers all key points.,variant_hybrid_rerank
